figure-iri, figure-number, figure-caption
<http://ceur-ws.org/figure/vol-1500-paper6_fig1>, "1"^^xsd:integer, "QueST definition of the HappyPeople MT"
<http://ceur-ws.org/figure/vol-1500-paper6_fig2>, "2"^^xsd:integer, "Instance generation"
<http://ceur-ws.org/figure/vol-1500-paper6_fig3>, "3"^^xsd:integer, "Alloy Specification of HappyPeople MT definition in Fig. 1"
<http://ceur-ws.org/figure/vol-1500-paper6_fig4>, "4"^^xsd:integer, "Properties specified in Alloy"
<http://ceur-ws.org/figure/vol-1500-paper6_fig5>, "5"^^xsd:integer, "A counterexample generated by the Alloy analyzer for Prop. 2"
