figure-iri, figure-number, figure-caption
<http://ceur-ws.org/figure/vol-1531-paper8_fig1>, "1"^^xsd:integer, "Overview of the Proposed Framework"
<http://ceur-ws.org/figure/vol-1531-paper8_fig2>, "2"^^xsd:integer, "LQN model of WeatherApp"
<http://ceur-ws.org/figure/vol-1531-paper8_fig3>, "3"^^xsd:integer, "Base Middleware Model (BMM)"
<http://ceur-ws.org/figure/vol-1531-paper8_fig4>, "4"^^xsd:integer, "Sub-feature models of ServiceManager and Broker"
<http://ceur-ws.org/figure/vol-1531-paper8_fig5>, "5"^^xsd:integer, "Structure-modifying realization of encryption feature"
<http://ceur-ws.org/figure/vol-1531-paper8_fig6>, "6"^^xsd:integer, "Specialized Middleware Model (SMM1)."
<http://ceur-ws.org/figure/vol-1531-paper8_fig7>, "7"^^xsd:integer, "Specialized Software Model (weatherApp+SMM1)"
